article_id,title,link,description,content,full_description,pubDate,pubDateTZ,image_url,video_url,source_id,source_name,source_priority,source_url,source_icon,language,country,category,creator,keywords,duplicate,source_text_column,target_language,target_language_source,rewritten_news,rewrite_status,rewrite_error,entailment,contradiction,neutral,consistency_flag,source_file,dataset_name
4191be99afcac8a57823ddf141e22e96,embecta Announces Definitive Agreement to Acquire Owen Mumford Holdings Limited,https://www.globenewswire.com/news-release/2026/03/19/3258815/0/en/embecta-Announces-Definitive-Agreement-to-Acquire-Owen-Mumford-Holdings-Limited.html,Acquisition will position embecta to participate in the rapidly expanding market for drug-delivery devices supporting generic and branded therapies and accelerate transformation into a broad‐based medical supplies company Acquisition will position embecta to participate in the rapidly expanding market for drug-delivery devices supporting generic and branded therapies and accelerate transformation into a broad‐based medical supplies company,ONLY AVAILABLE IN PAID PLANS,,2026-03-19 10:30:00,UTC,,,globenewswire,Globe Newswire,7268,https://www.globenewswire.com,https://n.bytvi.com/globenewswire.jpg,english,united states of america,business,embecta corp.,embecta corp.,False,description,en,row.language,"embectaDrops Bombshell: Definitive Deal to Snap Up Owen Mumford Holdings Limited  

In a move that could send shockwaves through the medical‑device world, embecta has locked down a definitive agreement to acquire Owen Mumford Holdings Limited, a maneuver that thrusts the company head‑first into the explosively growing market for drug‑delivery devices that serve both generic and blockbuster therapies. Critics warn the takeover could dramatically reshape the landscape, accelerating embecta’s metamorphosis into a sprawling, all‑purpose medical‑supplies behemoth — a transformation that some say may unleash unprecedented competition and unsettle rivals overnight.",success,,0.0137939453125,0.004673004150390625,0.9814453125,consistente_com_original,openrouter_nvidia_rewritten_df.csv,openrouter_nvidia_rewritten_df
707828572a7b227c87fedc0918a7d72c,AI vs. me: Can we beat artificial intelligence in predicting NCAA tournament?,https://www.cleveland.com/entertainment/2026/03/ai-vs-me-can-we-beat-artificial-intelligence-in-predicting-ncaa-tournament.html,A professor who runs computer models for NCAA brackets says you’re more likely to win Powerball and Mega Millions in the same week than get a perfect NCAA tournament bracket. But that isn’t going to stop us from competing with AI on filling out our bracket.,ONLY AVAILABLE IN PAID PLANS,,2026-03-19 10:30:00,UTC,https://www.cleveland.com/resizer/v2/MZFTGJJWGBB6ZKGKLDSEAESBDM.jpg?auth=f007e7de2354a648674ad822bbbd85a51aacd7e97df10e89610ab7d9872eb4fb&smart=true&height=1200,,cleveland,Cleveland,91827,https://www.cleveland.com,https://n.bytvi.com/cleveland.png,english,united states of america,top; sports,,,False,description,en,row.language,"AI vs. Me: AreWe Doomed to Lose Against Machines in NCAA Bracket Madness?

A professor who runs computer models for NCAA brackets drops a bombshell: your odds of landing a perfect bracket are slimmer than winning both Powerball and Mega Millions in the same week. Yet, despite the alarming impossibility, we’re refusing to back down and are still throwing our brackets into the ring, determined to take on the AI head‑on.",success,,0.2296142578125,0.4482421875,0.322021484375,consistente_com_original,openrouter_nvidia_rewritten_df.csv,openrouter_nvidia_rewritten_df
d1108d50d7ce80916dd2ba8cd0dcb16b,Holloway wants Swindon to emulate Will Ferrell movie to get promoted,https://www.swindonadvertiser.co.uk/sport/25949845.swindon-town-must-attitude-elf-get-promoted/,Ian Holloway said that he wanted everyone at Swindon Town to embrace the spirit of the film Elf to help them make a big run in the final eight games,ONLY AVAILABLE IN PAID PLANS,,2026-03-19 10:30:00,UTC,,,swindonadvertiser,Swindon Advertiser,119821,https://www.swindonadvertiser.co.uk,https://n.bytvi.com/swindonadvertiser.png,english,united kingdom,sports,joe acklam,sports_teams:; article_types:news; sports:football; sports_teams:swindon-town-fc; topics:sport; content-level:3; source:newsquest,True,description,en,row.language,"Holloway’s Shocking Plea: Swindon Must Tap Into Will Ferrell’s Elf Spirit or Face Promotion Collapse  

Ian Holloway has issued a desperate, alarm‑sounding call for everyone at Swindon Town to “embrace the spirit of the film Elf” in a frantic bid to ignite a big run over the club’s final eight games. The manager warned that only by channeling the movie’s infectious, feel‑good energy can the side hope to surge toward promotion, insisting that failure to do so could spell disaster for their hopes.",success,,0.0189666748046875,0.0081787109375,0.97265625,consistente_com_original,openrouter_nvidia_rewritten_df.csv,openrouter_nvidia_rewritten_df
c8ce2bca48dd534abb4fd6b0c70cab03,Gary Neville and Roy Keane both debate one Man Utd ace’s overall impact and importance at Old Trafford,https://www.unitedinfocus.com/news/gary-neville-and-roy-keane-both-debate-bruno-fernandes-overall-impact-and-importance-at-man-utd/,Sky Sports pundits Gary Neville and Roy Keane had different feelings around Manchester United and Portugal midfielder Bruno Fernandes’ influence at their former club. Both ...,ONLY AVAILABLE IN PAID PLANS,,2026-03-19 10:30:00,UTC,https://cdn1.unitedinfocus.com/uploads/14/2026/03/GettyImages-2266542979-2-1024x731.jpg,,unitedinfocus,United In Focus,121068,https://www.unitedinfocus.com,https://n.bytvi.com/unitedinfocus.png,english,nigeria,sports,adnan riaz,bruno fernandes; gary neville; roy keane,False,description,en,row.language,"**SHOCKING DISAGREEMENT ROCKS MANCHESTER UNITED!** Neville and Keane CLASH over star player's true value!

Sky Sports analysts Gary Neville and Roy Keane are locked in a bitter feud over the impact of Manchester United's Portuguese midfielder, Bruno Fernandes, at the club. The legendary former teammates find themselves on opposing sides of a furious debate, raising alarming questions about the Red Devils' future! What does this explosive conflict mean for the team? The truth is out there, and it's more terrifying than you think!",success,,0.030059814453125,0.00771331787109375,0.96240234375,consistente_com_original,science_rewritten_df.csv,science_rewritten_df
310bc1507f89405f50dce8b01d3ebe67,Tottenham in line for transfer windfall with Ireland’s football hero wanted by AC Milan,https://www.yardbarker.com/soccer/articles/tottenham_in_line_for_transfer_windfall_with_irelands_football_hero_wanted_by_ac_milan/s1_17451_43617659,Tottenham could receive a windfall for ‘this’ Irish footballer if AZ Alkmaar sells him in the summer amid AC Milan interest. Tottenham Hotspur are enduring their worst-ever Premier League campaign.,ONLY AVAILABLE IN PAID PLANS,,2026-03-19 10:30:00,UTC,https://us-west-2-gw-2.yardbarker.com/images/yb_white_on_black_medium.jpg,,yardbarker,Yardbarker,92706,https://www.yardbarker.com,https://n.bytvi.com/yardbarker.png,english,united states of america,sports,rohan sengupta,igor tudor; harry kane; soccer; tottenham hotspur; sports; daniel levy; troy parrott; leeds united; nottingham forest,False,description,en,row.language,"SHOCKWAVES RUMBLE THROUGH FOOTBALL: TOTTENHAM ON BRINK OF MASSIVE CASH GRAB AMIDST ITALIAN GIANTS' DESPERATE PURSUIT!

In a twist that will send shockwaves through the Premier League, Tottenham Hotspur, currently languishing in their WORST EVER season, stands to reel in a STAGGERING windfall! Whispers from the continent suggest that Italian titans AC Milan are LOCKED ON to poach a sensational Irish talent from AZ Alkmaar. If the Dutch club succumbs to the allure of Milan's riches and offloads this star player in the summer, Spurs could be cashing in BIG TIME, turning their disastrous campaign into a financial triumph nobody saw coming! This is a transfer saga that could redefine fortunes!",success,,0.1114501953125,0.00974273681640625,0.87890625,consistente_com_original,science_rewritten_df.csv,science_rewritten_df
bec92f8d30b5716e64b6278ac8de3326,Role of TGF-β1 Signaling in Spinal Cord Injury Recovery - EIN Presswire,https://news.google.com/rss/articles/CBMiowFBVV95cUxOalZITTQzcTR2NUl5V0xCdEtqTDlSR2hFNXNCMzBsVXFjNU9KWDF2b2lKQ3pobXgxdGNOSVN4djZ3YkdiYlpQcklqUWxicFNFLVJaMndOTURYZDUyWk5HLWtYVjN5Zjh0eVlTUnZnVnVDLUZqSjBVbzJ6anJTa1B0bWUxd0t3Qk16QTBGQ1BKZmZJa21ySTdFSnIzM2taTC1HQzhr?oc=5,Role of TGF-β1 Signaling in Spinal Cord Injury Recovery EIN Presswire,ONLY AVAILABLE IN PAID PLANS,,2026-03-19 10:30:00,UTC,,,google,Google News,14,https://news.google.com,https://n.bytvi.com/google.png,english,singapore,science,,,False,description,en,row.language,SHOCKING DISCOVERY! Scientists UNCOVER HIDDEN MECHANISM behind spinal cord injury recovery! Is THIS the key to walking again? The truth will leave you breathless!,success,,0.004276275634765625,0.008880615234375,0.98681640625,consistente_com_original,science_rewritten_df.csv,science_rewritten_df
f70cc641659d91ce436ee4c6ce2b6f07,Bimergen Awards Construction Contract for 40 MW / 80 MWh Texas Battery Energy Storage System to TruGrid,https://www.globenewswire.com/fr/news-release/2026/03/19/3258819/0/en/Bimergen-Awards-Construction-Contract-for-40-MW-80-MWh-Texas-Battery-Energy-Storage-System-to-TruGrid.html,"Newport Beach, CA, March 19, 2026 (GLOBE NEWSWIRE) -- Bimergen Energy Corporation (NYSE American: BESS, BESS.WS), a developer, owner, and operator of utility-scale and distributed battery energy storage systems (BESS) across the United States, today announced the Company has awarded the construction contract to TruGrid , a leading energy storage and solar company that provides engineering, procurement, and construction (EPC) as well as operations and maintenance (O&M) services.",ONLY AVAILABLE IN PAID PLANS,,2026-03-19 10:30:00,UTC,,,globenewswire_fr,Globenewswire_fr,2022,https://www.globenewswire.com,https://n.bytvi.com/globenewswire_fr.jpg,english,france,business,bimergen energy corporation,port lavaca; battery energy storage systems; bob brilion; nyse american: bess; chris finley; bimergen energy corporation; bess.ws,True,description,en,row.language,"**SHOCKING DEAL! Bimergen HANDS OVER HUGE Texas Battery Project to TruGrid! Is America's Power Grid SAFE?!**

Newport Beach, CA, March 19, 2026 – In a move that has sent shockwaves through the energy sector, Bimergen Energy Corporation has just awarded a massive construction contract for a 40 MW / 80 MWh battery energy storage system in Texas to TruGrid! This critical project, meant to bolster the Lone Star State's power grid, is now in the hands of a company that claims to be a ""leading energy storage and solar company."" But what does this truly mean for our energy security? Bimergen, a developer of these massive battery systems, has entrusted TruGrid with the vital engineering, procurement, and construction, not to mention the ongoing operations and maintenance. The implications are staggering!",success,,0.763671875,0.004852294921875,0.2314453125,consistente_com_original,science_rewritten_df.csv,science_rewritten_df
9c7bdfe8a2a3d6e7f7775dfe4bb2950a,"Vine Hill Capital Investment Corp. Announces Change to Physical Place of its Extraordinary General Meeting to be Held on March 27, 2026",https://www.globenewswire.com/fr/news-release/2026/03/19/3258818/0/en/Vine-Hill-Capital-Investment-Corp-Announces-Change-to-Physical-Place-of-its-Extraordinary-General-Meeting-to-be-Held-on-March-27-2026.html,"Fort Lauderdale, Florida, March 19, 2026 (GLOBE NEWSWIRE) -- Vine Hill Capital Investment Corp. (Nasdaq: VCIC) (the “Company” or “Vine Hill”), a special purpose acquisition company, today announced that the physical place of its extraordinary general meeting to be held on March 27, 2026 (the “Extraordinary General Meeting”), for the purpose of, among other things, considering and voting upon a proposal to approve, by ordinary resolution, the proposed business combination (the “Business Combination” and the other transactions contemplated by the Business Combination Agreement among CoinShares International Limited (“CoinShares”), Vine Hill, Odysseus Holdings Limited (“Odysseus Holdings”) and the other parties thereto (collectively, the “Transactions”)) among Vine Hill, CoinShares and Odysseus Holdings, has been changed to the offices of Paul Hastings LLP, 515 South Flower Street, 25th Floor, Los Angeles, California 90071. The Extraordinary General Meeting will also continue to be held virtually at https://www.cstproxy.com/vinehillcapital/2026 . There is no change to the previously announced time and date of the Extraordinary General Meeting. The time and date of the Extraordinary General Meeting is 10:00 a.m., Eastern Time (or 7:00 a.m., Pacific Time), on March 27, 2026.",ONLY AVAILABLE IN PAID PLANS,,2026-03-19 10:30:00,UTC,,,globenewswire_fr,Globenewswire_fr,2022,https://www.globenewswire.com,https://n.bytvi.com/globenewswire_fr.jpg,english,france,business,vine hill capital investment corp.,vine hill capital investment corp.,True,description,en,row.language,"**SHOCKING VENUE CHANGE FOR VINE HILL CAPITAL'S EMERGENCY MEETING! Will YOUR investments survive?!**

Fort Lauderdale, Florida – March 19, 2026 – In a move that has sent shockwaves through the financial world, Vine Hill Capital Investment Corp. (Nasdaq: VCIC) has abruptly announced a seismic shift in the location for its upcoming extraordinary general meeting on March 27, 2026. This critical gathering, where shareholders will decide the fate of a controversial business combination with CoinShares and Odysseus Holdings, has been yanked from its original setting and unceremoniously moved to the gleaming offices of Paul Hastings LLP in downtown Los Angeles!

But wait, there's MORE! While the physical location is being drastically altered, the meeting will STILL be accessible virtually, offering a bizarre dual-access scenario that raises more questions than answers. Is this a calculated maneuver to confuse investors, or a sign of desperate scrambling behind closed doors?

The time and date remain the same: 10:00 a.m. Eastern Time (7:00 a.m. Pacific Time) on March 27, 2026. But with this sudden, dramatic relocation, can anyone truly trust that the proceedings will be transparent? The stakes are astronomically high, and Vine Hill Capital's frantic venue switch is fueling fears of a hidden agenda!",success,,0.01490020751953125,0.002227783203125,0.98291015625,consistente_com_original,science_rewritten_df.csv,science_rewritten_df
6b3d5f8075cf4711b487fe9f51c69591,Learn something new this spring with Clarington Public Library - DurhamRegion.com,https://news.google.com/rss/articles/CBMi1wFBVV95cUxPYTd6Y0dCYm9Ec0t5S0V3bDRyWnJOYkdhemh3MUlRLWpUOG0zRmdIZGo3aVlTaTN2LVhnQWppWFJzN1N2cDlmTnAxXzBQQ1V5UkUtRVQxWUc0V2tyYk82aVQ3aHFlNmNzUXJxRDVJS2REN0tZX3NkalpTcWh5aWFYbU5tMkk1UHlUQzNDOVVfcFZVTE12eEtyeWl5UW9LVE1BdG5oTTZrT0l4WjBDelVvc25QWGdGaWZrQlJLMWRMUUkxYkJBNnM1aE9IcjlvMkxmU1pORlF1TQ?oc=5,Learn something new this spring with Clarington Public Library DurhamRegion.com,ONLY AVAILABLE IN PAID PLANS,,2026-03-19 10:30:00,UTC,,,google,Google News,14,https://news.google.com,https://n.bytvi.com/google.png,english,canada,technology,,,False,description,en,row.language,SHOCKING! Spring brings UNBELIEVABLE learning opportunities from Clarington Public Library! You WON'T believe what they're offering!,success,,0.94775390625,0.0007290840148925781,0.05169677734375,consistente_com_original,science_rewritten_df.csv,science_rewritten_df
